Pl,Numéros réponse,Position,Réponse (French),Answer (English),Enquête (French),Inquiry (English),LOC,DET,CON,QUAL
,79,>,"Là je vais un peu plus loin
 en termes d’interprétation, là en
 fait j’ai l’impression qu’il y a
 quelqu’un allongé avec un lit
 remonté et quelqu’un qui est
 comme ça (s’appuie avec ses
 coudes sur la table) à côté, tu vois,
 et du coup la scène que j’interprète
 c’est que là t’as un troisième
 personnage, trois couleurs trois
 personnages
 Celui
 -là est plus proche, avec une
 grosse tête tu vois, c’est un enfant
 Là c’est un adulte (vert) , un
 adulte qui borde le mourant, et le
 gosse qui est à côté qui regarde la
 scène.
 et un autre adulte (orange), là je le
 vois comme un adulte mourant
 (orange), Ce qui est assez drôle, je pense
 que c’est le jeu des couleurs qui
 fait ça, c’est peut être cliché mais
 je vois un homme (vert), une
 femme (orange), et
 paradoxalement, je vois un petit
 garçon
 Je pense que c’est parce que ça me
 rappelle une scène que j’ai déjà vu
 en l’occurrence, mais les genres là
 ils sont inversés c’était ma tante
 qui bordait mon arrière-grand-père je crois, une grande tante que je
 connais à peine.",,"La couleur car une
 couleur un personnage
 et la forme pour
 l’histoire
 C’était flippant de voir
 ça
 Dd34
 – moitié latérale
 de la tache entière (G)
 gauche C’est drôle parce que je
 vois la poitrine (dans le
 orange) et une pipe
 (dans le vert) mais je
 n’ai jamais vu une
 femme fumer la pipe.
 Puis bon quand tu
 bordes un malade tu
 fumes pas une pipe
 quoi. Il a des lunettes
 aussi puis j’imagine
 vraiment le mec avec
 ses lunettes sa pipe et
 voilà.",,Dd,CK-,H / Obj,"→Clob Devit
 Contam Affect
 Rem C+
 Ref pers →autocrit
 Ref phal"
,80,>,"Cette zone-là, une fois
 encore, de t’façon je crois qu’on
 voit toujours un peu la même,
 chose, mais là avec le choix des
 couleurs, on dirait vraiment une île
 et c’est pour le coup assez joli car
 les couleurs commencent à
 vraiment devenir intéressantes.
 T’as vraiment l’île avec le début
 du bout de orange et tout ça, t’as
 vraiment la mer et le ciel mais qui
 sont un peu embrumés tout ça
 vraiment très joli Voilà
 C’est marrant parce qu’ils ne
 mettent de la couleur qu’à la fin,",,"La forme et l’intérieur
 bleu clair
 Dbl8 – Lacune centrale",,Dbl,FCE-,Pays,"Rem C+
 →critobj
 Persev (île)
 Cn
 →K"
X,81,^,"Ça me fait penser à une
 mouche, non à un moustique
 plutôt, genre la trompe super fine,
 avec les gros yeux",,"La forme
 D11 – Gros médian
 supérieur entier",,D,F+/-,A,"Ref phal
 yeux"
,82,^,"Bizarre, je vois un
 bonhomme mais en négatif, c’està-dire que t’as genre les jambes ici
 (montre le blanc), et je sais pas
 pourquoi il a ça sur les jambes,
 une brassière ou je sais pas quoi,
 tu vois, ou un soutif plutôt, et du
 coup la tête est là sauf que les
 proportion sont bizarres, et là c’est
 l’espèce de creux du cou (orange) tu vois, du coup ça fait un super
 cou balaise et il n’y a pas de bras
 Surtout que c’est assez bizarre, il y
 a une ambiance, heu je sais pas
 c’est tout à fait bizarre, mais je le
 vois en négatif c’est ça qui est
 drôle",,"La forme et la couleur
 blanche
 Ddbl30 – Lacune dans
 la partie intérieure +
 D6- bleu médian + D3
 orange médian",,Ddbl,FC’-,(H) / vêt,"Ref phal
 →E
 →Critobj
 →Clob
 →radio"
,83,^,"Ça, ça me fait penser à la
 tour Eiffel",,"La forme et la couleur
 D11 – gris médian
 supérieur entier",,D,FC+,Arch,Ref phal
,84,^,"Ça, ça me fait penser à
 genre des crabes qui se baladent
 avec une feuille",,"La forme
 Dd55- Bleu latéral +
 vert latéral supérieur
 (Dd 32*2)",,Dd,kan+,A / Bot,BAN
,85,^,"Ça, ça me fait penser à
 une fourmi qui se balade genre
 avec une feuille d’automne",,"La couleur et la forme
 Dd51 – Jaune latéral
 (Dd15) + brun latéral
 (D7)",,Dd,kanC+,A/ Bot,
,86,^,": Ça, ça me fait penser à des
 œufs Il y a plein de trucs qui me font
 penser à de la bouffe là-dedans
 aussi",,"La couleur et la forme
 car un rond dans un
 truc
 Des œufs au plat
 D40 – Les deux jaunes
 médians inférieurs
 (D2*2)",,D,CF-,Alim,Ref orale
,87,^,"Tu vois ça, ça me fait
 penser à des crevettes En fait je sais pas, pourtant j’ai
 bien manger à midi, ça me fait
 quand même pas mal penser à de
 la nourriture",,"La couleur et la forme D-42 les deux roses
 latéraux (D9*2)",,D,CF-,Alim,Ref orale →devit Ref pers
,88,v,"J’arrive vraiment pas à
 voir l’ensemble, ça, ça me fait
 penser à des hippocampes tu vois,
 et du pesto (rires), vu que je suis
 parti sur le thème de la nourriture
 et du coup il y a de la continuité Elle ne m’inspire pas de trop, c’est
 dommage, c’est la plus colorée, la
 plus….",,"La forme et la couleur
 –
 D 10 – Vert médian
 inférieur entier",,D,FC +,A / Alim,"Autocrit
 Comb fab Rem C
 Critobj
 →Impot"
,89,>,"C’est un peu capillotracté
 un peu après, mais là t’aurai un
 soleil qui se lève un peu comme
 ça, et des usines avec de la fumée
 très sombre, t’as le soleil, et là je
 sais pas quel est l’origine de ce
 truc là en bleu, mais t’as encore
 vraiment cette notion de vent avec
 le côté usine et la fumée qui est un
 peu plus je sais pas rose, je sais
 pas quoi qui est au contact de je
 sais pas quel autre truc et ça
 change de couleur.
 De toute façon tout va dans le
 même sens Voilà, en fait elle m’inspire pas
 beaucoup celle là",,"La forme
 Le tout",,G,kobE-,"Pays / arch
 / Elem /
 Frag","→autocrit
 Repet (vent) →Impot
 critobj"
,90,v,": Là ça me fait penser à une
 chèvre (rires), et pour le coup c’est
 pas trop mal je trouve.
 Tu sais, les chèvres et les chiens
 ils ont ça aussi, en fait ils ont une
 truffe, et un espèce de truc ‘fin tu
 vois quoi, et du coup ça (orange),
 ça me fait vachement penser au
 piff d’une chèvre ou d’un … et c’est ça qui crée le trucs avec les
 yeux ici (montre blanc)",,"La forme dans le blanc
 –
 Ddbl29 Lacune dans la
 partie intérieure
 supérieure + orangé
 médian (cerise)",,Ddbl,FC’-,A,"Ref phal
 Yeux"
,91,v,"T’as un gouffre tu vois,
 t’as le bord du gouffre là, deux
 types, deux personnes qui se
 tiennent la main et qui essayent de
 genre s’aider à passer au-dessus
 du gouffre tu vois, et toi t’as la vue
 d’en dessous, t’es en contreplongée et tu vois les mecs audessus qui essayent de s’aider à
 traverser le gouffre, tu vois",,"La forme –
 D 42 – les deux roses
 latéraux + D6 – bleu
 médian",,Dd,KE-,"H / Nat
 /Scène","Ref phal
 Rem lien"